Name,Description,Latitude,Longitude,InfoURL,ImageURL
UCSB,A great university located along the California coast!,34.416929,-119.845991,"https://en.wikipedia.org/wiki/University_of_California, _Santa_Barbara",https://www.history.ucsb.edu/wp-content/uploads/La goonFall20141.jpg
Point Mugu,"A nice reserve and national park on the beach, perfect for camping.",34.086381,-119.060883,https://www.parks.ca.gov/?page_id=630,"https://en.wikipedia.org/wiki/Point_Mugu,_California#/media/File:Point_Mugu_September_2013_013.jpg"
"Exeter, CA","My hometown and the gateway to the Sequoias, perfect town with small town charm",36.295428,-119.144276,https://nationalparktraveling.com/listing/exeter-california/,https://nationalparktraveling.com/listing/exeter-california/
"Ventura, CA","My fathers hometown, where his family lives, an often forgotten oasis on the Central Coast.",34.258758,-119.268727,https://www.cityofventura.ca.gov/594/About-Ventura,https://www.cityofventura.ca.gov/594/About-Ventura
"Grants Grove, CA",Site of my family cabin and in the beautiful mountains of the Sierra Nevada mountains.,36.731516,-118.954993,https://www.google.com/url?sa=i&source=images&cd=&ved=2ahUKEwjPl4y35vTlAhWJvZ4KHZY-CzMQjRx6BAgBEAQ&url=http%3A%2F%2Fwww.redwoodhikes.com%2FSequoiaNP%2FGrant.html&psig=AOvVaw0qAWWBz59zfWCYi9rLKdUH&ust=1574202219291719,http://www.redwoodhikes.com/SequoiaNP/Grant.html
San Fransisco,"san Fransisco is one of California's oldest cities, and is world renowned for its beautiful attractions such as the Golden Gate Bridge.",37.809293,-122.47701,https://en.wikipedia.org/wiki/San_Francisco,https://www.google.com/imgres?imgurl=https%3A%2F%2Fwww.sftravel.com%2Fsites%2Fsftraveldev.prod.acquia-sites.com%2Ffiles%2FSanFrancisco_0.jpg&imgrefurl=https%3A%2F%2Fwww.sftravel.com%2Fneighborhoods&docid=dWpGVR2VmBu3sM&tbnid=cbnxHwrr0WRaKM%3A&vet=10ahUKEwip5cOP5_TlAhUQip4KHf0nCRwQMwh4KAEwAQ..i&w=1500&h=830&bih=907&biw=1680&q=san%20fran&ved=0ahUKEwip5cOP5_TlAhUQip4KHf0nCRwQMwh4KAEwAQ&iact=mrc&uact=8
